Zone,Accuracy,AUC,AP,Count,Positive Samples
Total,0.57307249712313,0.6590228537529308,0.16562215977288783,869.0,91.0
Transitional plain zone of Inland drainage,0.40655105973025046,0.5717192860050003,0.19053814765636523,519.0,78.0
Semi arid eastern plain,0.8648648648648649,0.8904109589041096,0.08333333333333333,148.0,2.0
Transitional plain zone of Luni Basin,0.8279569892473119,0.4465909090909091,0.1428014060798634,93.0,5.0
Flood prone eastern plain,0.6578947368421053,0.6756756756756757,0.07692307692307693,38.0,1.0
Southern humid plain,1.0,0.0,0.0,34.0,0.0
Arid Western Plain and Hyper Arid Partial irrigated,0.5652173913043478,0.47777777777777775,0.2398989898989899,23.0,5.0
South eastern humid plain,1.0,0.0,0.0,9.0,0.0
Sub humid southern plain and alluvial hill,0.2,0.0,0.0,5.0,0.0
